modifier_name,applies_to,effect_summary,scoring_impact,other_impact,constraints,notes
Bonus Cards,playing_card,Enhanced card gives an additional +30 Chips when scored,Enhanced card gives an additional +30 Chips when scored,scoring; deck_change,,
Glass Cards,playing_card,Enhanced card gives X2 Mult when scored 1 in 4 chance to destroy card after all scoring is finished,Enhanced card gives X2 Mult when scored 1 in 4 chance to destroy card after all scoring is finished,scoring; deck_change,,
Gold Cards,playing_card,Enhanced card gives $3 if held in hand at end of round,,deck_change; economy,,
Lucky Cards,playing_card,"Enhanced card has a 1 in 5 chance to give +20 Mult Enhanced card has a 1 in 15 chance to give $20 (Both effects are rolled separately, and both can trigger on the same turn)","Enhanced card has a 1 in 5 chance to give +20 Mult Enhanced card has a 1 in 15 chance to give $20 (Both effects are rolled separately, and both can trigger on the same turn)",scoring; deck_change; economy,,
Mult Cards,playing_card,Enhanced card gives +4 Mult when scored,Enhanced card gives +4 Mult when scored,scoring; deck_change,,
Steel Cards,playing_card,Enhanced card gives X1.5 Mult while held in hand,Enhanced card gives X1.5 Mult while held in hand,scoring; deck_change,,
Stone Cards,playing_card,Enhanced card's value is set to +50 Chips Enhanced card has no rank or suit Enhanced card always scores,Enhanced card's value is set to +50 Chips Enhanced card has no rank or suit Enhanced card always scores,scoring; deck_change,,
Wild Cards,playing_card,Enhanced card is considered to be every suit simultaneously,Enhanced card is considered to be every suit simultaneously,scoring; deck_change,,
